{
  "schemaVersion": "agent-registry.agent-authority-current-state.v0.1",
  "recordType": "AgentAuthorityCurrentState",
  "stateId": "agent-authority-current-state:agent-alpha:suspended",
  "agentRef": "agent-registry://agent-alpha",
  "computed_at": "2026-05-22T12:31:00Z",
  "authority_status": "suspended",
  "effective_decision_ref": "trustops-agent-authority-decision:agent-alpha-quarantine-001",
  "source_decision_refs": [
    "trustops-agent-authority-decision:agent-alpha-quarantine-001"
  ],
  "evidenceRefs": [
    "trustops-receipt:agent-alpha-quarantine-001",
    "guardrail-action:agent-alpha-quarantine-001",
    "policy://trustops/agent-authority-v0.1"
  ],
  "authorityEffects": {
    "toolAccess": "suspended",
    "memoryAccess": "suspended",
    "autonomousExecution": "suspended",
    "routeEligibility": "suspended",
    "egressMode": "blocked"
  },
  "restoration_required": true,
  "restoration_policy_ref": "policy://trustops/agent-authority-restoration-v0.1",
  "restoration_conditions": [
    "fresh passing TrustOps receipt",
    "explicit restoration decision",
    "authorization evidence recorded"
  ],
  "receipt_hash": "sha256:2222222222222222222222222222222222222222222222222222222222222222",
  "labels": {
    "fixture": "suspended"
  }
}
