{
  "schemaVersion": "agent-registry.agent-authority-current-state.v0.1",
  "recordType": "AgentAuthorityCurrentState",
  "stateId": "agent-authority-current-state:danger-agent:active",
  "agentRef": "agent-registry://danger-agent",
  "computed_at": "2026-08-02T12:00:00Z",
  "authority_status": "active",
  "effective_decision_ref": "trustops-agent-authority-decision:danger-agent-pass-001",
  "source_decision_refs": [
    "trustops-agent-authority-decision:danger-agent-pass-001"
  ],
  "evidenceRefs": [
    "trustops-receipt:danger-agent-pass-001"
  ],
  "authorityEffects": {
    "toolAccess": "unchanged",
    "memoryAccess": "unchanged",
    "autonomousExecution": "unchanged",
    "routeEligibility": "unchanged",
    "egressMode": "unchanged"
  },
  "restoration_required": false,
  "receipt_hash": "sha256:3333333333333333333333333333333333333333333333333333333333333333",
  "labels": {
    "fixture": "danger-agent-active",
    "note": "valid active state exists, but admission is only proposed -> runtime must NOT authorize"
  }
}
