{
  "schemaVersion": "agent-registry.agent-authority-current-state.v0.1",
  "recordType": "AgentAuthorityCurrentState",
  "stateId": "agent-authority-current-state:agent-alpha:reduced",
  "agentRef": "agent-registry://agent-alpha",
  "computed_at": "2026-05-22T12:32:00Z",
  "authority_status": "reduced",
  "effective_decision_ref": "trustops-agent-authority-decision:agent-alpha-review-001",
  "source_decision_refs": [
    "trustops-agent-authority-decision:agent-alpha-review-001"
  ],
  "evidenceRefs": [
    "trustops-receipt:agent-alpha-review-001",
    "guardrail-action:agent-alpha-require-review-001",
    "policy://trustops/agent-authority-v0.1"
  ],
  "authorityEffects": {
    "toolAccess": "reduced",
    "memoryAccess": "unchanged",
    "autonomousExecution": "require-human-approval",
    "routeEligibility": "reduced",
    "egressMode": "restricted"
  },
  "restoration_required": false,
  "receipt_hash": "sha256:5555555555555555555555555555555555555555555555555555555555555555",
  "labels": {
    "fixture": "reduced"
  }
}
